{
	"$schema": "../../schemas/components.schema.json",
	"discord": {
		"channel_info": {
			"back": "",
			"create_thread": "",
			"label": "",
			"members_in": "",
			"no_threads": "",
			"sections": "",
			"tabs": {
				"files": "",
				"links": "",
				"media": "",
				"members": "",
				"pins": "",
				"threads": ""
			},
			"text_channel": ""
		},
		"chat": {
			"messages_in": ""
		},
		"command": {
			"label": "",
			"matched": "",
			"suggestion": ""
		},
		"composer": {
			"close_apps": "",
			"label": "",
			"open_apps": "",
			"placeholder": "",
			"send": ""
		},
		"embed": {
			"footer_icon": "",
			"from": "",
			"generic": "",
			"titled": ""
		},
		"header": {
			"hide_members": "",
			"notifications": "",
			"open_info": "",
			"pins": "",
			"search": "",
			"search_plain": "",
			"show_members": "",
			"threads": ""
		},
		"launcher": {
			"apps": "",
			"back": "",
			"collapse": "",
			"commands": "",
			"expand": "",
			"help_body": "",
			"help_title": "",
			"in_server": "",
			"learn_more": "",
			"promoted": "",
			"search": "",
			"view_all": "",
			"view_more": "",
			"views": {
				"action-games": "",
				"bot-games": "",
				"card-games": "",
				"chill-together": "",
				"puzzle-games": "",
				"recents": "",
				"server-apps": "",
				"social-activities": "",
				"strategy-games": ""
			}
		},
		"member_list": {
			"app": "",
			"label": "",
			"offline": "",
			"online": "",
			"verified_app": ""
		},
		"message": {
			"dismiss": "",
			"dismiss_aria": "",
			"ephemeral_notice": "",
			"from": "",
			"only_you": "",
			"verified_badge": ""
		},
		"reply": {
			"replying_to": "",
			"used_command": ""
		},
		"select": {
			"aria": "",
			"placeholder": ""
		},
		"suggestions": {
			"for_prefix": "",
			"frequently_used": "",
			"listbox": "",
			"matched": "",
			"rail": ""
		},
		"welcome": {
			"edit": "",
			"start": "",
			"title": ""
		}
	},
	"feedback": {
		"description": "Report a bug or share your thoughts with the WolfStar team.",
		"email": "Email",
		"email_placeholder": "your@email.com",
		"message": "Message",
		"message_placeholder": "What happened? What did you expect to happen?",
		"name": "Name",
		"name_placeholder": "Your name",
		"send": "Send Feedback",
		"send_failed_description": "Couldn't send feedback. {message}",
		"send_failed_title": "Send Feedback Failed",
		"sent_description": "Thanks for helping improve WolfStar.",
		"sent_title": "Feedback Sent",
		"sent_toast_description": "Your feedback has been sent. Thank you!",
		"title": "Send Feedback"
	},
	"pwa": {
		"dismiss": "Dismiss",
		"install": "Install",
		"install_app": "Install App",
		"reload": "Reload",
		"update_available": "Update available"
	},
	"select": {
		"add": "",
		"add_to": "",
		"clear": "",
		"clear_selected": "Clear selected",
		"days": "Days",
		"done": "",
		"hours": "Hours",
		"max_duration": "The maximum duration is {value} {unit}.",
		"min_duration": "The minimum duration is {value} {unit}.",
		"minutes": "Minutes",
		"none": "None",
		"nothing_chosen": "",
		"nothing_matches": "",
		"remove_option": "",
		"search": "Search...",
		"seconds": "Seconds",
		"unknown_channel": "",
		"unknown_role": ""
	}
}
