{
	"$schema": "../../schemas/components.schema.json",
	"discord": {
		"channel_info": {
			"back": "",
			"create_thread": "",
			"label": "",
			"members_in": "",
			"no_threads": "",
			"sections": "",
			"tabs": {
				"files": "",
				"links": "",
				"media": "",
				"members": "",
				"pins": "",
				"threads": ""
			},
			"text_channel": ""
		},
		"chat": {
			"messages_in": ""
		},
		"command": {
			"label": "",
			"matched": "",
			"suggestion": ""
		},
		"composer": {
			"close_apps": "",
			"label": "",
			"open_apps": "",
			"placeholder": "",
			"send": ""
		},
		"embed": {
			"footer_icon": "",
			"from": "",
			"generic": "",
			"titled": ""
		},
		"header": {
			"hide_members": "",
			"notifications": "",
			"open_info": "",
			"pins": "",
			"search": "",
			"search_plain": "",
			"show_members": "",
			"threads": ""
		},
		"launcher": {
			"apps": "",
			"back": "",
			"collapse": "",
			"commands": "",
			"expand": "",
			"help_body": "",
			"help_title": "",
			"in_server": "",
			"learn_more": "",
			"promoted": "",
			"search": "",
			"view_all": "",
			"view_more": "",
			"views": {
				"action-games": "",
				"bot-games": "",
				"card-games": "",
				"chill-together": "",
				"puzzle-games": "",
				"recents": "",
				"server-apps": "",
				"social-activities": "",
				"strategy-games": ""
			}
		},
		"member_list": {
			"app": "",
			"label": "",
			"offline": "",
			"online": "",
			"verified_app": ""
		},
		"message": {
			"dismiss": "",
			"dismiss_aria": "",
			"ephemeral_notice": "",
			"from": "",
			"only_you": "",
			"verified_badge": ""
		},
		"reply": {
			"replying_to": "",
			"used_command": ""
		},
		"select": {
			"aria": "",
			"placeholder": ""
		},
		"suggestions": {
			"for_prefix": "",
			"frequently_used": "",
			"listbox": "",
			"matched": "",
			"rail": ""
		},
		"welcome": {
			"edit": "",
			"start": "",
			"title": ""
		}
	},
	"feedback": {
		"description": "Informa de un error o comparte tus opiniones con el equipo de WolfStar.",
		"email": "Correo electrónico",
		"email_placeholder": "tu@email.com",
		"message": "Mensaje",
		"message_placeholder": "Cuéntanos qué piensas...",
		"name": "Nombre",
		"name_placeholder": "Tu nombre",
		"send": "Enviar comentarios",
		"send_failed_description": "No se pudo enviar el comentario. Inténtalo de nuevo.",
		"send_failed_title": "Error al enviar",
		"sent_description": "Gracias por ayudar a mejorar WolfStar.",
		"sent_title": "Comentarios enviados",
		"sent_toast_description": "Gracias por ayudar a mejorar WolfStar.",
		"title": "Enviar comentarios"
	},
	"pwa": {
		"dismiss": "Cerrar",
		"install": "Install",
		"install_app": "Instalar app",
		"reload": "Recargar",
		"update_available": "Actualización disponible"
	},
	"select": {
		"add": "",
		"add_to": "",
		"clear": "",
		"clear_selected": "Limpiar selección",
		"days": "Días",
		"done": "",
		"hours": "Horas",
		"max_duration": "Duración máxima",
		"min_duration": "Duración mínima",
		"minutes": "Minutos",
		"none": "Ninguno",
		"nothing_chosen": "",
		"nothing_matches": "",
		"remove_option": "",
		"search": "Buscar...",
		"seconds": "Segundos",
		"unknown_channel": "",
		"unknown_role": ""
	}
}
